{
  "benchmarkID" : "asr-public-fluid-paraformer-fleurs-mandarin-v1",
  "configHash" : "009eb367f80f2637f85b786ff45e408f08f3fb189204094b1aa31c640277b175",
  "corpus" : {
    "manifestID" : "fleurs-public-asr-tuning-v1",
    "split" : "tuning",
    "version" : "1.0.0"
  },
  "environmentRef" : "artifacts/evidence/environment/check-summary.json",
  "failedSampleUUIDs" : [

  ],
  "hardware" : {
    "architecture" : "arm64",
    "osVersion" : "Version 26.6.2 (Build 25G83)",
    "toolchainVersion" : "Apple Swift version 6.3.3 (swiftlang-6.3.3.1.3 clang-2100.1.1.101) Target: arm64-apple-macosx26.0",
    "unifiedMemoryBytes" : 51539607552
  },
  "implementationRevision" : "19600a485baa4998812e4654b70d2bab8f2c9949",
  "kind" : "benchmark-result",
  "metrics" : [
    {
      "direction" : "lower-is-better",
      "name" : "cer",
      "unit" : "ratio",
      "value" : 0.14961389961389962
    },
    {
      "direction" : "lower-is-better",
      "name" : "wer",
      "unit" : "ratio",
      "value" : 0.9928825622775801
    },
    {
      "direction" : "lower-is-better",
      "name" : "mer",
      "unit" : "ratio",
      "value" : 0.12550607287449392
    },
    {
      "direction" : "lower-is-better",
      "name" : "dangerous-token-errors",
      "unit" : "count",
      "value" : 0
    },
    {
      "direction" : "lower-is-better",
      "name" : "dangerous-token-errors.action-owner",
      "unit" : "count",
      "value" : 0
    },
    {
      "direction" : "lower-is-better",
      "name" : "dangerous-token-errors.date",
      "unit" : "count",
      "value" : 0
    },
    {
      "direction" : "lower-is-better",
      "name" : "dangerous-token-errors.negation",
      "unit" : "count",
      "value" : 0
    },
    {
      "direction" : "lower-is-better",
      "name" : "dangerous-token-errors.number",
      "unit" : "count",
      "value" : 0
    },
    {
      "direction" : "lower-is-better",
      "name" : "dangerous-token-errors.person",
      "unit" : "count",
      "value" : 0
    },
    {
      "direction" : "lower-is-better",
      "name" : "der",
      "unit" : "ratio",
      "value" : 0
    },
    {
      "direction" : "lower-is-better",
      "name" : "jer",
      "unit" : "ratio",
      "value" : 0
    },
    {
      "direction" : "lower-is-better",
      "name" : "speaker-miss-rate",
      "unit" : "ratio",
      "value" : 0
    },
    {
      "direction" : "lower-is-better",
      "name" : "speaker-false-alarm-rate",
      "unit" : "ratio",
      "value" : 0
    },
    {
      "direction" : "lower-is-better",
      "name" : "speaker-confusion-rate",
      "unit" : "ratio",
      "value" : 0
    },
    {
      "direction" : "lower-is-better",
      "name" : "false-merge-count",
      "unit" : "count",
      "value" : 0
    },
    {
      "direction" : "lower-is-better",
      "name" : "false-split-count",
      "unit" : "count",
      "value" : 0
    },
    {
      "direction" : "lower-is-better",
      "name" : "false-reject-count",
      "unit" : "count",
      "value" : 0
    },
    {
      "direction" : "lower-is-better",
      "name" : "latency-p50",
      "unit" : "milliseconds",
      "value" : 246.029667
    },
    {
      "direction" : "lower-is-better",
      "name" : "latency-p95",
      "unit" : "milliseconds",
      "value" : 427.963125
    },
    {
      "direction" : "lower-is-better",
      "name" : "realtime-factor",
      "unit" : "ratio",
      "value" : 0.028059896557499592
    },
    {
      "direction" : "informational",
      "name" : "peak-rss",
      "unit" : "bytes",
      "value" : 906035200
    },
    {
      "direction" : "informational",
      "name" : "backlog-high-watermark",
      "unit" : "jobs",
      "value" : 1
    }
  ],
  "modelArtifact" : {
    "artifactID" : "fluid-paraformer-large-zh-int8-5dd557bd",
    "sha256" : "d1a072eea0c4b478452e0f5143920aae35a4e4484e9f20808ed5579e5a3b26b6"
  },
  "protocolVersion" : 1,
  "runID" : "7D8CF011-DCA8-4DA2-AB70-618D82774625",
  "schemaVersion" : 1,
  "task" : "asr"
}