{
  "schemaVersion": 1,
  "kind": "benchmark-result",
  "benchmarkID": "asr-smoke-v1",
  "runID": "11111111-1111-4111-8111-111111111111",
  "task": "asr",
  "protocolVersion": 1,
  "implementationRevision": "fixture-revision",
  "modelArtifact": {
    "artifactID": "fixture-asr-v1",
    "sha256": "aaaaaaaaaaaaaaaaaaaaaaaaaaaaaaaaaaaaaaaaaaaaaaaaaaaaaaaaaaaaaaaa"
  },
  "configHash": "bbbbbbbbbbbbbbbbbbbbbbbbbbbbbbbbbbbbbbbbbbbbbbbbbbbbbbbbbbbbbbbb",
  "corpus": {
    "manifestID": "synthetic-smoke",
    "version": "1.0.0",
    "split": "smoke"
  },
  "environmentRef": "fixture://environment/arm64-offline",
  "hardware": {
    "osVersion": "14.2",
    "architecture": "arm64",
    "unifiedMemoryBytes": 17179869184,
    "toolchainVersion": "Swift 6 fixture"
  },
  "metrics": [
    {
      "name": "realtime-factor",
      "value": 0.25,
      "unit": "ratio",
      "direction": "lower-is-better"
    }
  ],
  "failedSampleUUIDs": []
}
